{
  "pcd_spec_version": "1.0.2",
  "decision": {
    "id": "pcd-a1-state-auto-approve",
    "boundary": "deploy",
    "outcome": "approved",
    "effective_window": {
      "start": "2025-11-15T00:00:00Z",
      "end": "2026-11-15T00:00:00Z"
    },
    "routed": false,
    "replayable": true
  },
  "artifacts": {
    "models": [
      {
        "id": "pcd-a1-state-auto-approve-model",
        "sha256": "2af88381acc22849504ca51474c06eff50cefe232280218c3a157ea8d496d832"
      }
    ],
    "policies": [
      {
        "id": "pcd-a1-state-auto-approve-policy",
        "sha256": "fc98471f1b4995d1a53d3d8a251f323b0de3f9710d3027f35d2d87a32a1eeff0"
      }
    ]
  },
  "lineage": [
    {
      "id": "step-1",
      "op": "policy_evaluation",
      "types": {
        "inputs": [
          "model",
          "policy"
        ],
        "outputs": [
          "verdict"
        ]
      },
      "inputs": [
        "pcd-a1-state-auto-approve-model",
        "pcd-a1-state-auto-approve-policy"
      ],
      "outputs": [
        "pcd-a1-state-auto-approve-verdict"
      ],
      "policy_refs": [
        "pcd-a1-state-auto-approve-policy"
      ],
      "stochastic": false
    }
  ],
  "controls": {
    "fail_closed": true,
    "policy_dsl": "internal-v1",
    "replay": {
      "strategy": "state"
    }
  },
  "attestations": {
    "canonical_hash": "94baef99b2c1fd15283418525634cf5b88ab3656402f9eba72385a0d1e0ee920",
    "signatures": [
      {
        "key_id": "policy-key-001",
        "algorithm": "EdDSA",
        "signature": "bec4aaffdee4d562790a36524bce296b9fae1f9e1faaa92be66d707a7b52e1a4",
        "role": "policy"
      },
      {
        "key_id": "runtime-key-005",
        "algorithm": "EdDSA",
        "signature": "533e7648c2fbff06e70104018b78024bf1eb83bb93718d55041b9bdaab88e535",
        "role": "runtime"
      }
    ],
    "timestamps": {
      "policy_signed": "2025-11-14T10:00:00Z",
      "exec_start": "2025-11-14T10:30:00Z",
      "exec_end": "2025-11-14T10:31:00Z"
    },
    "key_roles": {
      "policy": [
        "policy-key-001"
      ],
      "runtime": [
        "runtime-key-005"
      ]
    }
  }
}
