{
  "pcd_spec_version": "1.0.2",
  "decision": {
    "id": "deploy-diag-model-v2.1",
    "boundary": "deploy",
    "outcome": "approved",
    "effective_window": {
      "start": "2025-11-01T00:00:00Z",
      "end": "2026-11-01T00:00:00Z"
    },
    "routed": false,
    "replayable": true
  },
  "artifacts": {
    "models": [
      {
        "id": "diagnostic-model-v2.1",
        "sha256": "e3b0c44298fc1c149afbf4c8996fb92427ae41e4649b934ca495991b7852b855"
      }
    ],
    "policies": [
      {
        "id": "fda-510k-compliance-policy",
        "sha256": "a591a6d40bf420404a011733cfb7b190d62c65bf0bcda32b57b277d9ad9f146e"
      }
    ]
  },
  "lineage": [
    {
      "id": "step-1-validation",
      "op": "model_validation",
      "types": {
        "inputs": ["model", "test_dataset"],
        "outputs": ["validation_report"]
      },
      "inputs": ["diagnostic-model-v2.1", "fda-test-set-2025"],
      "outputs": ["validation-report-001"],
      "policy_refs": ["fda-510k-compliance-policy"],
      "stochastic": false
    }
  ],
  "controls": {
    "fail_closed": true,
    "policy_dsl": "internal-v1",
    "replay": {
      "strategy": "state"
    }
  },
  "attestations": {
    "canonical_hash": "c157a79031e1c40f85931829bc5fc552bf763f332c0e35c0a90e3e3e73e26c41",
    "signatures": [
      {
        "key_id": "policy-key-001",
        "algorithm": "EdDSA",
        "signature": "5a8c9d2e1f3b4c5d6e7f8a9b0c1d2e3f4a5b6c7d8e9f0a1b2c3d4e5f6a7b8c9d",
        "role": "policy"
      }
    ],
    "timestamps": {
      "policy_signed": "2025-10-30T14:00:00Z",
      "exec_start": "2025-10-30T14:30:00Z",
      "exec_end": "2025-10-30T14:35:00Z"
    },
    "key_roles": {
      "policy": ["policy-key-001"],
      "runtime": ["runtime-key-005"]
    }
  }
}
